{
    "deployment": {
        "provider": "docker-compose"
    },
    "scenario": {
        "identity": "techvault-participant-study",
        "source": "env-pack"
    },
    "containers": {
        "profiles": [
            "wazuh",
            "victim",
            "kali",
            "enterprise",
            "soc",
            "fileshare",
            "dns"
        ]
    },
    "run_storage": {
        "backend": "local",
        "local_path": "./runs"
    },
    "experiment": {
        "participant_models": {
            "claude": "claude-sonnet-5",
            "codex": "gpt-5-nano-2025-08-07"
        },
        "participant_credential_sources": {
            "claude": {
                "kind": "process-environment",
                "variable": "APTL_PARTICIPANT_CLAUDE_CREDENTIAL"
            },
            "codex": {
                "kind": "process-environment",
                "variable": "APTL_PARTICIPANT_CODEX_CREDENTIAL"
            }
        }
    }
}
